asin,name,date
B0FC5TBWG5,iQOO Z10 Lite 5G Cyber Green 4GB RAM 128GB Storage  6000 mAh Battery  Dimensity 6300 5G Processor wi,2026-05-09 17:39:14
B0FDW55HNT,Klosia Womens Rayon Printed Anarkali Kurta And Pant With Dupatta,2026-05-10 23:03:04
B07DP24NSR,Pampers Complete Skin Comfort Pants M 76 Count Anti-Rash Blanket,2026-05-11 16:34:53
B0BTTNR391,Ledo Mens And Womens Watch Box Holder Organizer Case In,2026-05-12 10:40:24
B0D2JGNLQM,Muthoot Pappachan Swarnavarsham 24K 999 Yellow Gold Oval Laxmi Pendant,2026-05-12 23:43:04
B0821PN8L4,Amazon Brand - Presto Garbage Bags Medium 180 Count 30,2026-05-13 16:50:49
B09W5PSTBP,Lifelong Pvc Hex Dumbbells Pack Of 2 5Kg2 Black Color,2026-05-15 10:04:24
B0GPN9R146,Happi Planet Magic Eraser Pack Of 4 No Scratch Multi-Surface,2026-05-15 14:33:01
B0DZ2YY9NC,Amazon Basics Unisex Faux Leather Watch Organiser Box With 6,2026-05-18 23:21:17
B0DYVPP86H,Shining Diva Fashion 5 Pcs Latest Stylish Heart Butterfly Pearl,2026-05-19 09:14:08
B09MVWHJ9J,Luvlap Pant Style Baby Diapers Large L 62 Count For,2026-05-19 10:05:16
B071CMQ6N2,Youbella Jewellery Bracelets For Women Stylish Rose Gold Plated Crystal,2026-05-19 11:04:07
B0DG6P57NC,6 Pcs Drain Basket Set With Handles - Versatile Kitchen,2026-05-19 11:15:39
B077BFH786,Softspun Microfiber Cloth - 4 Pcs - 40X40 Cms -,2026-05-19 21:07:42
B0FRFXX2C3,Klosia Womens Rayon Printed Anarkali Kurta And Pant With Dupatta,2026-05-20 02:00:39
B0D3DCP7JQ,Shining Diva Fashion 5 Pcs Combo Latest Stylish Infinity Butterfly,2026-05-20 02:12:27
B0GXLKNLV8,Original Air Conditioner Remote Control Compatible With Voltas Ac Remote,2026-05-20 17:16:55
B0FMDL81GS,Oneplus Nord Buds 3R Tws Earbuds Up To 54 Hours,2026-05-20 22:38:35
B071WBXFXQ,Dr Charcoal Air Purifier Bag For Car And Bathroom With,2026-05-21 09:21:00
B09D8CXJ2Q,Doctor Extra Soft Care Diabetic Orthopedic Pregnancy Flat Super Comfort,2026-05-21 20:34:44
B0FQ5JVLL8,Fresh Assorted Roses Button Roses 100G,2026-05-21 20:57:31
B0GNS926P3,Fabloft Charger Adapter For Bf-888S 777S 666S Eu Plug1 Piece,2026-05-22 08:27:02
B0GJKWWQCZ,Iphone Original Type C To Lighting Charger Cable Mfi Certified,2026-05-22 21:25:51
B09D8BQM7C,Doctor Extra Soft Care Diabetic Orthopedic Pregnancy Flat Super Comfort,2026-05-23 00:39:23
B085HGYJF6,Lb Ray Cooking Spray Sunflower Oil - Low-Calorie 100 Oil,2026-05-23 01:05:46
B0BS6Y66VT,Bonzella Transparent Paper Sticker Book Cover Film Book Binding Cover,2026-05-23 23:36:14
B0FP4S4JX2,Kleenest Magic Eraser Cleaning Sponge Pack Of 4 Chemical-Free Multi-Purpose,2026-05-23 23:50:04
B0CCM8L54V,Zulaxy Photo Frame Hooks For Wall Without Drilling 10 Pack,2026-05-24 00:01:11
B06VX8YR6Q,Ezee Live Life Ezee Way Black Garbage Bags For Dustbin90,2026-05-24 00:30:51
B0CP3TKZZH,Beetel G10 Newly Launched Corded Landline Phone Ringer Led Indication,2026-05-28 01:08:12
B098NS6PVG,Ambrane Unbreakable 3A Fast Charging 15M Braided Type C Cable,2026-05-28 14:01:25
B0CMTZ92DC,Jialto 20 Pcs Self Adhesive Hooks For Secure Wall Hanging,2026-05-28 23:48:56
B0DRCT1MTK,Go24 Pexpo Water Bottle 1 Ltr Stainless Steel Sportsfridge Bottle,2026-05-29 14:57:08
B0B6NSDR2H,Slovic Pull Up Bar For Home For Kids Adults 100,2026-05-29 23:07:20
B0GXJZ6NQY,Original Universal Remote Compatible With Daikin Ac Remote Control For,2026-05-30 02:07:13
B0BYLK9PZC,Pngadgil Jewellers 1 Gm Vedhani Gold Ring 24 Kt 995,2026-05-30 09:39:36
B097JJ2CK6,Safari Omega Spaciouslarge Laptop Backpack With Raincover College Bag Travel,2026-05-30 09:48:41
B0B2F8XS9L,Babique Dog Plush Soft Toy Cute Kids Animal Home Decor,2026-05-30 13:30:45
B0C862R9VF,Lifelong Llks03 Foldable Kick Skating Cycle Skate Scooter For Kidsmax,2026-05-30 22:44:38
B00004TZY8,Mattel Uno Playing Card Game For 7 Yrs And Above,2026-05-30 22:47:15
B07NYD4PYY,Transparent Envelope Folder Poly-Plastic A4 Documents File Storage Bag With,2026-05-30 23:36:54
B0DRCYP93L,Go24 Pexpo Water Bottle,2026-06-01 18:11:04
B00MVV9NUY,Jk Easy Copier Paper A4,2026-06-01 20:26:50
B0CXDQWYQP,Godrej Aer O – Hanging,2026-06-02 13:43:18
B0GWLJL55D,Oneplus Nord Ce6,2026-06-02 20:32:01
B09W5LHL7G,Lifelong Pvc Hex Fixed Dumbbells,2026-06-03 13:27:27
B0BYVSTYP8,Liberty Force 10 School Shoes,2026-06-03 22:04:15
B0DQD8HWWG,Grenaro Mic,2026-06-04 09:19:53
B08JQ6CVJ3,Tygot Lightweight & Portable 7,2026-06-04 15:28:50
B0DZCJ1L63,Delightbee Transparent Self Adhesive Book,2026-06-04 23:34:49
B01J3F13O4,Vahdam Kashmiri Kahwa Tea Loose,2026-06-05 09:11:04
B0DD6ZXQLP,Appster Air Acoustic Tube Covert,2026-06-05 13:38:59
B0DK7B3B2G,Divija Store Wood Smart Multipurpose,2026-06-05 20:40:38
B08R7PMR6D,Vooki Eco Friendly Heavy Duty,2026-06-06 09:29:30
B0D2R2MXXJ,Fast Charge Everywhere 📈,2026-06-06 14:45:46
B0DZ7C519W,"1. Create Anywhere, Every Day 📚",2026-06-06 19:18:34
B0DDHM6D3L,Epic Sound in Your Ears 🎧,2026-06-07 11:11:51
B0DL3CH93D,Wireless Car Perfection in Your Ride 🚗,2026-06-07 15:40:58
B086DX4253,Unlock Forgotten Memories 📚,2026-06-07 22:39:30
B0FBRGKXHG,Unlock Deep Beats in 10 Minutes 🎧,2026-06-08 07:39:11
B082LSVT4B,"Unbreakable Cable, Unbeatable Life 💪",2026-06-08 09:06:36
B08MCD9JFY,Brighten Up Your Life 💡,2026-06-08 14:05:37
B0C1ZXQLP4,Road Trip Entertainment Made Easy 🚗,2026-06-08 20:57:30
B010EINLTY,Travel the World with Your Flicks 📽,2026-06-09 09:39:57
B0F2MMYP94,Kids Love This Insane Electric Bike 🚴,2026-06-09 14:59:30
B07HF3KD3D,Upgrade Your Movie Night 🍿,2026-06-09 22:52:15
B0FK5JF6BV,Music Freedom in Your Pocket 🎵,2026-06-10 10:05:44
B07TV97911,Wake Up to Unlimited Music 🎵,2026-06-10 10:20:13
B0CT86KG33,Say Goodbye to Forgotten Calls,2026-06-10 12:52:24
B0GFNHRN7N,1. Freedom In Your Fingers,2026-06-10 20:29:37
B0DY2SWV16,Unstoppable You in Minutes,2026-06-11 08:21:49
B0FC2YFSN4,"Binge Watch, No Cord Hassle",2026-06-11 13:20:53
B0G19XCNHG,"Big Screen, Zero Cost",2026-06-11 20:02:32
B00O2BU8PK,Bring Old Memories Back to Life,2026-06-12 09:55:20
B0GRVK2K1J,Wireless Car Miracles in Minutes,2026-06-12 13:44:21
B0GSJKWGT3,Protect Your Action Cam,2026-06-12 20:37:18
B0GSK82421,Hands Free Freedom Unlocked,2026-06-13 11:53:41
B0D1GYL3MN,"Print Anywhere, Everyday!",2026-06-13 12:05:11
B0DP7G56RG,Scan Your Old Photos Now,2026-06-13 16:02:45
B0FM38916Y,Unleash Your Beat,2026-06-14 09:48:39
B07FDC4SWM,See the World Unfiltered Now,2026-06-14 14:27:54
B0DCZ3WDTB,Charger for Life on the Go,2026-06-14 19:53:35
B0DTK5596V,Capture Life's Most Epic Moments,2026-06-15 09:21:20
B001THL8SQ,Fly Safe with Ultimate Sound,2026-06-15 14:09:24
B09VDQ2ZS9,Say Goodbye to Echo Calls Forever,2026-06-15 21:13:37
B0G64G64YL,Home Security Just Got Smarter,2026-06-16 10:09:36
B0BJ72WZQ7,1. Live Life to the Beat,2026-06-16 19:30:29
B0FLJLB9VQ,Unstoppable Home Server Powers,2026-06-17 14:57:37
B0DB269JKH,1. Safe Drive Pro,2026-06-17 19:39:03
B01JLAQGNY,Escape Reality in Stunning VR,2026-06-18 10:47:35
B0D6N9NHLD,"Big Screen, Anywhere, Anytime",2026-06-18 21:46:07
B008FWZGSG,Charge Anywhere with Ease,2026-06-19 13:36:49
B0DDX3RJ2R,Migraines Melt Away Instantly Now,2026-06-19 21:36:10
B08VFCN8WK,Certified Refurbished Fire TV Stick with all-,2026-06-19 19:32:25
B00MFNJKJ2,Portable Powerhouse of Sound,2026-06-20 01:30:21
B09QYZML29,Inefable® Mi Band 3 & 4 Strap Band Wristband ,2026-06-19 20:24:08
B0G4HVZMBP,EmbeTronicX GPS NEO-7M Satellite Positioning ,2026-06-19 21:07:51
B0GXPKL7R1,"One Ear, Endless Freedom",2026-06-19 21:33:25
B0FYGVCX8D,Earpiece Game Changer for Busy Lives,2026-06-19 22:50:40
B07CXW5FWN,Say Goodbye to Cluttered Wires,2026-06-19 23:04:12
B08MY7N27N,Fitbit Case That Saves Your Life,2026-06-20 03:45:32
B0DG5WSJQ2,Get the Perfect Fit,2026-06-20 03:58:55
B00A0VCJPI,"Wi-Fi Now Everywhere, No More Dead Zones",2026-06-20 04:08:15
B0C61RFC5S,Bring Back Forgotten Memories,2026-06-20 04:27:56
B00BX5FOCK,"Store More, Go Anywhere",2026-06-20 11:32:01
B0F8N74NVN,Projector Revolution at Home,2026-06-20 13:22:53
B08MY6PT4D,1. Fitbit Case Game Changer,2026-06-21 12:05:41
B0G7H7SXMS,Hands-Free Walkie Talkie Freedom,2026-06-21 15:26:57
B0D96HMLYX,OUTPUT REGULATION:,2026-06-21 19:09:28
B0FK4RND9C,Smart Security for Home Peace,2026-06-22 05:26:38
B0DC6PQMV1,Lock & Track Your Ride,2026-06-22 11:25:17
B0BQ6KSXJW,Cable Game Changer for Gamers,2026-06-22 13:56:05
B09CV44DT3,1. Elevate Your Photoshoot Game,2026-06-22 14:31:37
B09QYYV4H5,Upgrade Your Fitness Style Today,2026-06-22 14:53:41
B08H8CZDDH,Watch Your Favourite Movies,2026-06-22 14:53:42
B0FNRV6X18,Home Safe with Smart Surveillance,2026-06-22 14:53:43
B0G24PX37V,Here are the 3 lines of text:,2026-06-22 14:53:44
B0CFYJ8HRS,Erase Distractions with Pure Sound,2026-06-22 15:07:58
B098WZFNDM,Dust-Proof CPU Cooling Solution,2026-06-23 04:32:54
B0FRPPNYH3,Soundbar Control Just Got Easier,2026-06-23 09:57:41
B0BJDMH8PN,Fake Security Cameras That Fool Everyone,2026-06-23 13:53:57
B0CGQXY29P,"Drive Safely, Capture Everything",2026-06-23 15:45:14
B0GKVKPY7P,Unplug and Unleash Your Freedom,2026-06-24 03:09:47
B00MFNJN8K,"Tune In, Travel Free",2026-06-24 08:10:43
B0CYLQQPRX,Lost in Traffic?,2026-06-24 14:23:10
B0DL5XD88F,Protect Your Paperwhite Dreams,2026-06-25 04:51:19
B0G7D6SYF1,3D Vision Without the Headache,2026-06-25 09:37:08
B0H292QZQH,Fake It Till They Freak,2026-06-25 14:10:54
B0DT9ZPRRB,Smart Smartwatch for Busy Lives,2026-06-26 03:10:47
B0FHHQQNZY,Here are the 3 lines of text as per your requirements:,2026-06-26 08:11:15
B0CWPDYST4,Headphones Protected for a Year,2026-06-26 14:11:13
B0DGY4T4T8,See the World Hands-Free Now,2026-06-26 15:56:05
B0CL4YL615,Phone Stabilizer Magic in Your Hand,2026-06-27 03:21:02
B0D9S87H53,1. Wireless Power On The Go,2026-06-27 08:11:45
B0GQ4259R5,1. Protect Your Dashboard,2026-06-27 14:21:09
B0GG4W7N66,1. Fitness Tracker Revolution Unleashed,2026-06-28 03:10:32
B07BR2FQZN,Fish Like a Pro Every Time,2026-06-28 08:10:07
B09W27GY84,Long Distance No More Woes,2026-06-28 14:36:49
B0C4PVS224,Charge Any Device in Minutes,2026-06-29 03:18:27
B0FBRV6W9B,"Draw Anywhere, Anytime Freedom",2026-06-29 05:13:30
B077Z2P28F,Radio Freedom for Your Adventures,2026-06-29 08:18:24
B0GD6N759W,Mount & Ride Free,2026-06-29 14:28:29
B0GXL88RGJ,Music Everywhere Portable Radio,2026-06-30 03:09:00
B0GW8PQLLM,Wear Your Brain on Your Wrist,2026-06-30 08:12:52
B00LWRSJB2,"Survive the Unthinkable, One Button at a Time",2026-06-30 14:11:48
B0FC2Y3XGV,"Binge Watch, Game On, All Day",2026-07-01 03:15:36
